{
  "finishedLook": {
    "mode": "auto"
  },
  "grid": [
    [-1, -1, -1, -1, -1, -1, -1, -1, -1, -1, -1, -1, -1, -1, -1, -1, -1, -1, -1, -1, -1, -1, -1, -1],
    [-1, -1, 0, 0, 0, 0, 0, 0, 0, 0, 0, 0, 0, 0, 0, 0, 0, 0, 0, 0, 0, 0, -1, -1],
    [-1, 0, 0, 3, 3, 3, 3, 2, 2, 2, 2, 3, 3, 3, 3, 0, 0, 0, 0, 0, 0, 0, 0, -1],
    [-1, 0, 0, 3, 3, 3, 3, 2, 2, 2, 2, 3, 3, 3, 3, 0, 0, 0, 0, 0, 0, 0, 0, -1],
    [-1, 0, 0, 3, 3, 3, 3, 2, 2, 2, 2, 3, 3, 3, 3, 0, 0, 0, 0, 0, 0, 0, 0, -1],
    [-1, 0, 0, 3, 3, 3, 3, 3, 2, 2, 2, 3, 3, 3, 3, 0, 0, 0, 0, 0, 0, 0, 0, -1],
    [-1, 0, 0, 3, 3, 3, 3, 3, 2, 2, 3, 3, 3, 3, 3, 0, 0, 0, 0, 0, 0, 0, 0, -1],
    [-1, 0, 0, 3, 3, 3, 3, 3, 3, 3, 3, 3, 3, 3, 3, 2, 2, 2, 0, 0, 0, 0, 0, -1],
    [-1, 0, 0, 0, 0, 3, 3, 3, 3, 3, 3, 2, 3, 2, 2, 2, 2, 2, 2, 2, 0, 0, 0, -1],
    [-1, 0, 0, 0, 0, 3, 3, 3, 2, 3, 3, 1, 1, 1, 1, 1, 1, 2, 2, 2, 2, 0, 0, -1],
    [-1, 0, 0, 0, 0, 3, 3, 3, 2, 3, 3, 3, 3, 1, 1, 1, 1, 1, 1, 2, 2, 0, 0, -1],
    [-1, 0, 0, 0, 3, 3, 3, 3, 2, 3, 3, 3, 3, 3, 1, 1, 1, 1, 1, 1, 1, 0, 0, -1],
    [-1, 0, 0, 0, 3, 3, 3, 3, 2, 3, 3, 3, 3, 3, 0, 0, 0, 0, 0, 0, 0, 0, 0, -1],
    [-1, 0, 0, 0, 0, 3, 3, 3, 2, 3, 3, 3, 3, 0, 0, 0, 0, 0, 0, 0, 0, 0, 0, -1],
    [-1, 0, 0, 0, 0, 0, 3, 3, 2, 3, 3, 3, 0, 0, 0, 0, 0, 0, 0, 0, 0, 0, 0, -1],
    [-1, 0, 0, 0, 0, 0, 0, 0, 2, 3, 0, 0, 0, 0, 0, 0, 0, 0, 0, 0, 0, 0, 0, -1],
    [-1, 0, 0, 0, 0, 0, 0, 0, 0, 3, 0, 0, 0, 0, 0, 0, 0, 0, 0, 0, 0, 0, 0, -1],
    [-1, 0, 0, 0, 0, 0, 0, 0, 3, 3, 0, 0, 0, 0, 0, 0, 0, 0, 0, 0, 0, 0, 0, -1],
    [-1, 0, 0, 0, 0, 0, 0, 0, 3, 3, 2, 0, 0, 0, 0, 0, 0, 0, 0, 0, 0, 0, 0, -1],
    [-1, 0, 0, 0, 0, 0, 0, 0, 3, 3, 0, 0, 0, 0, 0, 0, 0, 0, 0, 0, 0, 0, 0, -1],
    [-1, 0, 0, 0, 0, 0, 0, 0, 3, 3, 3, 0, 0, 0, 0, 0, 0, 0, 0, 0, 0, 0, 0, -1],
    [-1, 0, 0, 0, 0, 0, 0, 0, 3, 3, 3, 0, 0, 0, 0, 0, 0, 0, 0, 0, 0, 0, 0, -1],
    [-1, -1, 0, 0, 0, 0, 0, 0, 0, 0, 0, 0, 0, 0, 0, 0, 0, 0, 0, 0, 0, 0, -1, -1],
    [-1, -1, -1, -1, -1, -1, -1, -1, -1, -1, -1, -1, -1, -1, -1, -1, -1, -1, -1, -1, -1, -1, -1, -1]
  ],
  "height": 24,
  "id": "cello_leaf_elevator",
  "review": {
    "notes": "Approved by the automated picture checks (FR-084 as amended on 2026-10-06).",
    "reviewer": "automated picture checks",
    "status": "approved"
  },
  "roles": [
    {
      "colorGroup": "blue_cyan",
      "isBackground": true,
      "name": "sky",
      "roleId": "sky"
    },
    {
      "colorGroup": "green",
      "name": "leaf",
      "roleId": "leaf"
    },
    {
      "colorGroup": "green",
      "name": "shadow",
      "roleId": "shadow"
    },
    {
      "colorGroup": "brown_orange",
      "name": "wood",
      "roleId": "wood"
    }
  ],
  "source": {
    "kind": "generated_edited",
    "licence": "owned",
    "origin": "content/launch-art/references/atlas-0092.png panel 20; quantized exact target-cell authoring grid; one-cell entry clearance"
  },
  "structure": {
    "backgroundShare": 0.522,
    "nestingDepth": 3,
    "regionCount": 8
  },
  "subject": "Cello Leaf Elevator",
  "tags": {
    "bands": ["big"],
    "themes": ["launch-original"]
  },
  "version": 1,
  "width": 24
}
