{
  "finishedLook": {
    "mode": "auto"
  },
  "grid": [
    [7, 7, 7, 7, 7, 7, 7, 7, 7, 7, 7, 7, 7, 7, 7, 7],
    [5, 0, 0, 0, 0, 0, 1, 1, -1, -1, 0, 0, -1, 0, 0, 5],
    [5, -1, 0, 0, 1, 1, 1, 1, 1, 1, 0, 0, 0, 0, 0, 5],
    [5, 0, 0, 0, 1, 1, 1, 1, 1, 1, 0, 0, 0, 0, -1, 5],
    [5, 0, 0, 0, 1, 1, 1, 0, 1, 1, 0, 0, -1, 0, 0, 5],
    [5, 0, -1, 1, 1, 1, 0, 0, 1, 1, 1, 0, 0, 0, -1, 5],
    [5, 0, 0, 1, 1, 1, 0, 0, 0, 3, 1, 0, 0, 0, -1, 5],
    [5, 0, 0, 1, 1, 1, 0, -1, 0, 1, 1, 0, 0, 0, 0, 5],
    [5, 0, 1, 1, 1, 1, 1, -1, 0, 1, 1, 0, 0, -1, 0, 5],
    [5, 0, 1, 2, 2, 2, 1, 0, 3, 3, 1, 0, 0, 0, 0, 5],
    [5, 0, 0, 1, 2, 1, 0, 0, 3, 1, 1, 0, 0, 0, -1, 5],
    [5, 0, 0, 0, 2, 0, 0, 0, 0, 1, 1, 0, -1, -1, 0, 5],
    [5, 0, 0, 0, 0, 0, -1, 0, 0, 3, 1, 0, 0, 0, 0, 5],
    [5, 0, 0, 0, 0, 0, 0, 0, 0, 1, 1, 0, 0, 0, 0, 5],
    [5, 5, 0, -1, -1, 0, -1, -1, 0, 1, 1, -1, 0, 0, 5, 5],
    [5, 5, 0, 0, 0, 0, 6, 6, 0, 0, 1, 4, 4, -1, 5, 5],
    [5, 5, 0, 0, 0, 0, 6, 6, -1, 0, -1, 4, 4, 0, 5, 5],
    [5, 5, 0, 0, 0, -1, 6, 0, 0, -1, 0, 4, 0, -1, 5, 5]
  ],
  "height": 18,
  "id": "saxophone_07",
  "review": {
    "notes": "Approved by the automated picture checks (FR-084 as amended on 2026-10-06).",
    "reviewer": "automated picture checks",
    "status": "approved"
  },
  "roles": [
    {
      "colorGroup": "blue_cyan",
      "isBackground": true,
      "name": "Stage",
      "roleId": "wall"
    },
    {
      "colorGroup": "lime",
      "name": "Golden saxophone",
      "roleId": "sax"
    },
    {
      "colorGroup": "brown_orange",
      "name": "Bell",
      "roleId": "bell"
    },
    {
      "colorGroup": "blue_cyan",
      "name": "Keys",
      "roleId": "keys"
    },
    {
      "colorGroup": "pink_purple",
      "name": "Mouthpiece",
      "roleId": "mouth"
    },
    {
      "colorGroup": "pink_purple",
      "name": "Curtains",
      "roleId": "curtain"
    },
    {
      "colorGroup": "green",
      "name": "Music notes",
      "roleId": "notes"
    },
    {
      "colorGroup": "green",
      "name": "Floor",
      "roleId": "floor"
    }
  ],
  "source": {
    "kind": "generated",
    "licence": "owned",
    "origin": "content/pictures/tools/sketch_pictures.py"
  },
  "structure": {
    "backgroundShare": 0.44,
    "nestingDepth": 3,
    "regionCount": 19
  },
  "subject": "Saxophone 7",
  "tags": {
    "bands": ["regular"],
    "themes": ["things", "music"]
  },
  "version": 1,
  "width": 16
}
