{
  "finishedLook": {
    "mode": "auto"
  },
  "grid": [
    [-1, -1, -1, -1, -1, -1, -1, -1, -1, -1, -1, -1, -1, -1, -1, -1, -1, -1, -1, -1, -1, -1, -1, -1, -1, -1, -1, -1],
    [-1, -1, 0, 0, 0, 0, 0, 1, 1, 1, 1, 1, 1, 1, 1, 1, 1, 1, 1, 1, 1, 0, 0, 0, 0, 0, -1, -1],
    [-1, 0, 0, 0, 0, 0, 2, 1, 1, 2, 1, 1, 1, 1, 1, 1, 1, 1, 1, 1, 1, 1, 1, 0, 0, 0, 0, -1],
    [-1, 0, 0, 0, 0, 1, 2, 2, 1, 1, 4, 4, 1, 1, 1, 1, 1, 4, 4, 1, 1, 1, 2, 1, 0, 0, 0, -1],
    [-1, 0, 0, 0, 2, 2, 1, 4, 4, 3, 3, 3, 1, 1, 1, 1, 4, 3, 3, 3, 4, 1, 2, 2, 0, 0, 0, -1],
    [-1, 0, 0, 0, 2, 4, 4, 4, 3, 3, 3, 3, 4, 4, 4, 4, 3, 3, 3, 3, 3, 4, 4, 4, 0, 0, 0, -1],
    [-1, 0, 0, 0, 0, 4, 4, 3, 3, 3, 3, 3, 4, 4, 3, 4, 3, 3, 3, 3, 3, 3, 4, 4, 0, 0, 0, -1],
    [-1, 0, 0, 0, 4, 4, 3, 3, 3, 3, 3, 3, 4, 3, 3, 3, 4, 3, 3, 3, 3, 3, 3, 4, 0, 0, 0, -1],
    [-1, 0, 0, 4, 4, 3, 3, 3, 3, 3, 3, 4, 3, 3, 3, 3, 3, 3, 3, 3, 3, 3, 3, 3, 4, 0, 0, -1],
    [-1, 0, 0, 4, 4, 3, 3, 3, 3, 3, 3, 3, 3, 3, 3, 3, 3, 4, 3, 4, 3, 3, 3, 3, 4, 0, 0, -1],
    [-1, 0, 0, 4, 4, 3, 3, 3, 3, 3, 3, 3, 3, 3, 3, 3, 3, 4, 3, 3, 3, 3, 3, 3, 4, 0, 0, -1],
    [-1, 0, 0, 4, 4, 4, 4, 3, 3, 3, 3, 3, 3, 3, 3, 3, 3, 4, 3, 3, 3, 4, 4, 4, 4, 0, 0, -1],
    [-1, 0, 0, 4, 4, 4, 4, 3, 3, 3, 4, 3, 3, 3, 3, 3, 3, 4, 4, 3, 3, 4, 4, 4, 4, 0, 0, -1],
    [-1, 0, 0, 4, 4, 4, 4, 3, 3, 4, 4, 4, 3, 3, 3, 3, 3, 4, 4, 4, 3, 4, 4, 4, 4, 0, 0, -1],
    [-1, 0, 0, 0, 4, 4, 4, 4, 4, 4, 4, 4, 4, 3, 3, 3, 4, 4, 4, 4, 4, 4, 4, 4, 0, 0, 0, -1],
    [-1, 0, 0, 0, 0, 4, 4, 4, 4, 4, 4, 4, 4, 3, 3, 4, 4, 4, 4, 4, 4, 4, 4, 4, 0, 0, 0, -1],
    [-1, 0, 0, 0, 0, 0, 4, 4, 4, 4, 4, 4, 4, 4, 4, 4, 4, 4, 4, 4, 4, 4, 4, 0, 0, 0, 0, -1],
    [-1, 0, 0, 0, 0, 0, 0, 4, 4, 4, 4, 4, 4, 4, 4, 4, 4, 4, 4, 4, 4, 4, 0, 0, 0, 0, 0, -1],
    [-1, 0, 0, 0, 0, 0, 0, 0, 0, 4, 4, 4, 4, 4, 4, 4, 4, 4, 4, 4, 0, 0, 0, 0, 0, 0, 0, -1],
    [-1, 0, 0, 0, 0, 0, 0, 0, 0, 0, 4, 4, 4, 4, 4, 4, 4, 4, 4, 0, 0, 0, 0, 0, 0, 0, 0, -1],
    [-1, 0, 0, 0, 0, 0, 0, 0, 0, 0, 0, 0, 2, 2, 2, 2, 2, 0, 0, 0, 0, 0, 0, 0, 0, 0, 0, -1],
    [-1, 0, 0, 0, 0, 0, 0, 0, 0, 0, 0, 0, 2, 2, 2, 2, 2, 0, 0, 0, 0, 0, 0, 0, 0, 0, 0, -1],
    [-1, 0, 0, 0, 0, 0, 0, 0, 0, 0, 0, 0, 1, 1, 2, 1, 1, 0, 0, 0, 0, 0, 0, 0, 0, 0, 0, -1],
    [-1, 0, 0, 0, 0, 0, 0, 0, 0, 0, 0, 0, 1, 1, 2, 1, 1, 0, 0, 0, 0, 0, 0, 0, 0, 0, 0, -1],
    [-1, 0, 0, 0, 0, 0, 0, 0, 0, 0, 0, 1, 1, 2, 2, 1, 1, 1, 0, 0, 0, 0, 0, 0, 0, 0, 0, -1],
    [-1, 0, 0, 0, 0, 0, 0, 0, 0, 0, 0, 0, 0, 0, 2, 0, 0, 0, 0, 0, 0, 0, 0, 0, 0, 0, 0, -1],
    [-1, -1, 0, 0, 0, 0, 0, 0, 0, 0, 0, 0, 0, 0, 2, 0, 0, 0, 0, 0, 0, 0, 0, 0, 0, 0, -1, -1],
    [-1, -1, -1, -1, -1, -1, -1, -1, -1, -1, -1, -1, -1, -1, -1, -1, -1, -1, -1, -1, -1, -1, -1, -1, -1, -1, -1, -1]
  ],
  "height": 28,
  "id": "orchid_bulb_lotus_harbor",
  "review": {
    "notes": "Approved by the automated picture checks (FR-084 as amended on 2026-10-06).",
    "reviewer": "automated picture checks",
    "status": "approved"
  },
  "roles": [
    {
      "colorGroup": "blue_cyan",
      "isBackground": true,
      "name": "sky",
      "roleId": "sky"
    },
    {
      "colorGroup": "green",
      "name": "leaf",
      "roleId": "leaf"
    },
    {
      "colorGroup": "green",
      "name": "shadow",
      "roleId": "shadow"
    },
    {
      "colorGroup": "pink_purple",
      "name": "petal",
      "roleId": "petal"
    },
    {
      "colorGroup": "lime",
      "name": "light",
      "roleId": "light"
    }
  ],
  "source": {
    "kind": "generated_edited",
    "licence": "owned",
    "origin": "content/launch-art/references/atlas-0079.png panel 19; quantized exact target-cell authoring grid"
  },
  "structure": {
    "backgroundShare": 0.371,
    "nestingDepth": 3,
    "regionCount": 24
  },
  "subject": "Orchid Bulb Lotus Harbor",
  "tags": {
    "bands": ["big"],
    "themes": ["launch-original"]
  },
  "version": 1,
  "width": 28
}
