{
  "finishedLook": {
    "mode": "auto"
  },
  "grid": [
    [4, 4, 4, 4, 4, 4, 4, 4, 4, 4, 4, 4, 4],
    [4, 4, 4, 4, 4, 4, 4, 4, 4, 4, 4, 4, 4],
    [0, 3, 3, 3, 3, 3, 3, 3, 3, 3, 3, 3, 0],
    [-1, 3, 3, 3, 1, 1, 1, 1, 3, 3, 3, 3, -1],
    [0, 3, 3, 1, 1, 1, 1, 1, 1, 3, 3, 3, -1],
    [0, -1, 1, 1, 1, 2, 2, 1, 1, 1, -1, 3, -1],
    [0, 0, 1, 1, 2, 2, 2, 2, 1, 1, 0, 3, -1],
    [-1, 0, 1, 1, 2, 2, 2, 1, 1, 1, -1, 0, -1],
    [0, 0, 1, 1, 1, 1, 1, 1, 1, 0, 0, 0, 0],
    [0, 0, 0, 1, 1, 1, 1, 1, 0, 0, 0, 0, 0],
    [0, 0, -1, -1, 0, 0, 0, 0, 0, 0, 0, 0, 0],
    [0, 0, -1, 0, 0, 0, 0, -1, -1, 0, 0, 0, 0],
    [0, 0, -1, 0, 0, 0, -1, 0, -1, -1, 0, 0, -1],
    [-1, 0, 0, -1, -1, -1, -1, 0, 0, 0, 0, 0, -1]
  ],
  "height": 14,
  "id": "snail_01",
  "review": {
    "notes": "Procedural sketch (content/pictures/tools/sketch_pictures.py); needs a recognizability review (FR-084, SC-015).",
    "status": "draft"
  },
  "roles": [
    {
      "colorGroup": "blue_cyan",
      "isBackground": true,
      "name": "Sky",
      "roleId": "sky"
    },
    {
      "colorGroup": "brown_orange",
      "name": "Shell",
      "roleId": "shell"
    },
    {
      "colorGroup": "brown_orange",
      "name": "Spiral",
      "roleId": "spiral"
    },
    {
      "colorGroup": "green",
      "name": "Body",
      "roleId": "body"
    },
    {
      "colorGroup": "green",
      "name": "Grass",
      "roleId": "grass"
    }
  ],
  "source": {
    "kind": "generated",
    "licence": "owned",
    "origin": "content/pictures/tools/sketch_pictures.py"
  },
  "structure": {
    "backgroundShare": 0.324,
    "nestingDepth": 4,
    "regionCount": 9
  },
  "subject": "Snail 1",
  "tags": {
    "bands": ["early_mid"],
    "themes": ["animals", "garden"]
  },
  "version": 2,
  "width": 13
}
