{
  "finishedLook": {
    "mode": "auto"
  },
  "grid": [
    [-1, -1, -1, -1, -1, -1, -1, -1, -1, -1, -1, -1, -1, -1, -1, -1, -1, -1, -1, -1, -1, -1, -1, -1, -1, -1, -1, -1, -1, -1],
    [-1, -1, 0, 0, 0, 0, 0, 0, 0, 0, 0, 0, 0, 0, 0, 0, 0, 0, 0, 0, 0, 0, 0, 0, 0, 0, 0, 0, -1, -1],
    [-1, 0, 0, 0, 1, 1, 0, 0, 0, 0, 0, 0, 0, 0, 0, 0, 0, 1, 0, 0, 0, 0, 0, 0, 0, 0, 0, 0, 0, -1],
    [-1, 1, 1, 1, 1, 1, 1, 1, 1, 1, 1, 1, 1, 1, 1, 1, 1, 1, 0, 0, 0, 0, 0, 0, 0, 0, 0, 0, 0, -1],
    [-1, 1, 2, 2, 2, 2, 2, 2, 2, 2, 2, 2, 2, 2, 2, 2, 2, 2, 0, 0, 0, 0, 0, 0, 0, 0, 0, 0, 0, -1],
    [-1, 0, 1, 1, 1, 1, 1, 1, 1, 1, 1, 1, 1, 1, 1, 1, 1, 2, 0, 0, 0, 0, 0, 0, 0, 0, 0, 0, 0, -1],
    [-1, 0, 1, 1, 2, 1, 1, 1, 1, 1, 4, 4, 1, 1, 1, 1, 1, 2, 0, 0, 0, 0, 0, 1, 1, 0, 0, 0, 0, -1],
    [-1, 0, 1, 1, 2, 1, 1, 1, 1, 1, 4, 2, 1, 1, 1, 1, 1, 2, 0, 0, 0, 2, 2, 2, 2, 2, 2, 2, 0, -1],
    [-1, 0, 1, 1, 2, 1, 1, 1, 1, 1, 1, 4, 1, 1, 1, 1, 1, 2, 0, 2, 2, 2, 4, 4, 3, 3, 4, 4, 2, -1],
    [-1, 0, 1, 1, 1, 1, 1, 1, 1, 1, 1, 1, 1, 1, 1, 1, 1, 1, 2, 2, 4, 4, 3, 3, 3, 3, 3, 3, 4, -1],
    [-1, 0, 2, 2, 2, 2, 2, 2, 2, 2, 2, 2, 2, 2, 2, 2, 2, 2, 2, 2, 4, 3, 3, 3, 3, 3, 3, 3, 4, -1],
    [-1, 0, 1, 1, 1, 0, 0, 3, 3, 3, 3, 3, 3, 1, 1, 1, 1, 2, 2, 4, 3, 3, 3, 3, 3, 3, 3, 4, 0, -1],
    [-1, 0, 0, 1, 0, 3, 1, 1, 1, 1, 1, 1, 1, 3, 1, 2, 2, 2, 4, 3, 3, 3, 3, 3, 3, 4, 1, 0, 0, -1],
    [-1, 0, 1, 1, 0, 0, 0, 1, 0, 4, 1, 1, 0, 2, 4, 4, 1, 2, 3, 3, 3, 3, 3, 3, 4, 0, 0, 0, 0, -1],
    [-1, 0, 0, 1, 0, 0, 0, 0, 0, 0, 0, 2, 2, 4, 4, 4, 1, 2, 3, 3, 3, 3, 3, 4, 0, 0, 0, 0, 0, -1],
    [-1, 0, 1, 1, 0, 0, 0, 0, 0, 0, 2, 4, 2, 4, 4, 1, 2, 4, 3, 3, 3, 3, 4, 0, 0, 0, 0, 0, 0, -1],
    [-1, 0, 2, 2, 0, 0, 0, 0, 0, 2, 4, 4, 4, 4, 4, 1, 2, 4, 3, 3, 3, 4, 1, 0, 0, 0, 0, 0, 0, -1],
    [-1, 0, 2, 2, 2, 0, 2, 2, 4, 4, 4, 4, 4, 4, 4, 2, 2, 3, 3, 3, 4, 0, 0, 0, 0, 0, 0, 0, 0, -1],
    [-1, 0, 2, 2, 2, 4, 4, 4, 4, 4, 2, 4, 4, 4, 1, 2, 4, 3, 3, 3, 1, 0, 0, 0, 0, 0, 0, 0, 0, -1],
    [-1, 0, 0, 2, 2, 4, 2, 4, 4, 4, 4, 4, 4, 4, 2, 4, 3, 3, 4, 1, 2, 0, 0, 0, 0, 0, 0, 0, 0, -1],
    [-1, 0, 0, 0, 2, 4, 4, 4, 4, 2, 4, 4, 4, 4, 3, 3, 4, 1, 1, 4, 2, 0, 0, 0, 0, 0, 0, 0, 0, -1],
    [-1, 0, 0, 0, 0, 0, 2, 4, 4, 4, 4, 2, 4, 4, 1, 1, 1, 1, 1, 4, 2, 0, 0, 0, 0, 0, 0, 0, 0, -1],
    [-1, 0, 0, 0, 0, 0, 0, 4, 4, 4, 4, 4, 2, 4, 1, 1, 1, 1, 1, 4, 2, 0, 0, 0, 0, 0, 0, 0, 0, -1],
    [-1, 0, 0, 0, 0, 0, 0, 2, 4, 4, 4, 4, 4, 4, 1, 1, 1, 1, 4, 2, 0, 0, 0, 0, 0, 0, 0, 0, 0, -1],
    [-1, 0, 0, 0, 0, 0, 0, 0, 2, 4, 4, 4, 4, 4, 1, 1, 1, 1, 4, 2, 0, 0, 0, 0, 0, 0, 0, 0, 0, -1],
    [-1, 0, 0, 0, 0, 0, 0, 0, 0, 2, 4, 4, 4, 4, 1, 1, 1, 4, 2, 0, 0, 0, 0, 0, 0, 0, 0, 0, 0, -1],
    [-1, 0, 0, 0, 0, 0, 0, 0, 0, 2, 2, 4, 4, 4, 1, 1, 1, 4, 2, 0, 0, 0, 0, 0, 0, 0, 0, 0, 0, -1],
    [-1, 0, 0, 0, 0, 0, 0, 0, 0, 0, 2, 4, 4, 4, 1, 1, 4, 2, 0, 0, 0, 0, 0, 0, 0, 0, 0, 0, 0, -1],
    [-1, 0, 0, 0, 0, 0, 0, 0, 0, 0, 0, 2, 4, 4, 4, 4, 2, 0, 0, 0, 0, 0, 0, 0, 0, 0, 0, 0, 0, -1],
    [-1, 0, 0, 0, 0, 0, 0, 0, 0, 0, 0, 0, 2, 2, 2, 2, 0, 0, 0, 0, 0, 0, 0, 0, 0, 0, 0, 0, 0, -1],
    [-1, -1, 0, 0, 0, 0, 0, 0, 0, 0, 0, 0, 0, 0, 0, 0, 0, 0, 0, 0, 0, 0, 0, 0, 0, 0, 0, 0, -1, -1],
    [-1, -1, -1, -1, -1, -1, -1, -1, -1, -1, -1, -1, -1, -1, -1, -1, -1, -1, -1, -1, -1, -1, -1, -1, -1, -1, -1, -1, -1, -1]
  ],
  "height": 32,
  "id": "gramophone_seed_sorter",
  "review": {
    "notes": "Approved by the automated picture checks (FR-084 as amended on 2026-10-06).",
    "reviewer": "automated picture checks",
    "status": "approved"
  },
  "roles": [
    {
      "colorGroup": "blue_cyan",
      "isBackground": true,
      "name": "sky",
      "roleId": "sky"
    },
    {
      "colorGroup": "green",
      "name": "shadow",
      "roleId": "shadow"
    },
    {
      "colorGroup": "brown_orange",
      "name": "wood",
      "roleId": "wood"
    },
    {
      "colorGroup": "pink_purple",
      "name": "petal",
      "roleId": "petal"
    },
    {
      "colorGroup": "lime",
      "name": "light",
      "roleId": "light"
    }
  ],
  "source": {
    "kind": "generated_edited",
    "licence": "owned",
    "origin": "content/launch-art/references/atlas-0047.png panel 12; quantized exact target-cell authoring grid"
  },
  "structure": {
    "backgroundShare": 0.404,
    "nestingDepth": 4,
    "regionCount": 79
  },
  "subject": "Gramophone Seed Sorter",
  "tags": {
    "bands": ["big"],
    "themes": ["launch-original"]
  },
  "version": 1,
  "width": 30
}
