{
  "finishedLook": {
    "mode": "auto"
  },
  "grid": [
    [9, 9, 9, 9, 9, 9, 9, 9, 9, 9, 9, 9, 9, 9],
    [9, 9, 9, 9, 9, 9, 9, 9, 9, 2, 2, 2, 2, 9],
    [-1, -1, 0, 0, 0, 0, -1, -1, 2, 2, 2, 2, 2, 0],
    [-1, -1, -1, 0, 0, 0, -1, 0, 0, 2, 2, 2, 2, 0],
    [0, 0, 0, -1, 0, 0, 0, 4, 4, 2, 2, 2, 2, 0],
    [-1, -1, 0, 0, 0, -1, 0, 4, 4, 2, 7, 7, 2, 0],
    [-1, 0, -1, 0, 0, 4, 4, 4, 5, 5, 7, 7, 2, -1],
    [-1, -1, 0, 0, 4, 4, 6, 6, 5, 5, 7, 2, 2, 0],
    [0, -1, 0, 0, 4, 4, 6, 6, 5, 2, 2, 2, 2, 0],
    [0, -1, 0, 0, 4, 4, 6, 6, 0, 2, 2, 2, 2, 0],
    [-1, -1, 0, -1, 4, 4, 4, 4, 0, 2, 2, 2, 2, -1],
    [-1, 0, 0, 0, 0, 4, 4, 4, -1, 2, 2, 2, 2, 0],
    [0, -1, -1, 3, 4, 4, 4, 4, 0, 2, 2, 2, 2, 0],
    [0, -1, 0, 0, 3, 3, 4, 4, 0, 2, 2, 2, 2, 0],
    [0, 1, 1, 1, 3, 0, 3, -1, -1, 2, 2, 2, 2, -1],
    [-1, 1, 1, 1, -1, -1, 0, 0, 0, 2, 8, 8, 8, 8],
    [0, 1, 1, 1, 0, 0, 0, 0, 0, 8, 8, 8, 8, 8],
    [-1, -1, 0, 0, 0, -1, 0, -1, 8, 8, 8, 8, 8, 8]
  ],
  "height": 18,
  "id": "woodpecker_02",
  "review": {
    "notes": "Approved by the automated picture checks (FR-084 as amended on 2026-10-06).",
    "reviewer": "automated picture checks",
    "status": "approved"
  },
  "roles": [
    {
      "colorGroup": "blue_cyan",
      "isBackground": true,
      "name": "Sky",
      "roleId": "sky"
    },
    {
      "colorGroup": "brown_orange",
      "name": "Sun",
      "roleId": "sun"
    },
    {
      "colorGroup": "brown_orange",
      "name": "Tree trunk",
      "roleId": "trunk"
    },
    {
      "colorGroup": "brown_orange",
      "name": "Crest",
      "roleId": "crest"
    },
    {
      "colorGroup": "pink_purple",
      "name": "Woodpecker",
      "roleId": "bird"
    },
    {
      "colorGroup": "pink_purple",
      "name": "Beak and claws",
      "roleId": "beak"
    },
    {
      "colorGroup": "green",
      "name": "Belly",
      "roleId": "belly"
    },
    {
      "colorGroup": "blue_cyan",
      "name": "Eye, wing spots and tree hole",
      "roleId": "eye"
    },
    {
      "colorGroup": "green",
      "name": "Leaves",
      "roleId": "leaves"
    },
    {
      "colorGroup": "green",
      "name": "Grass",
      "roleId": "grass"
    }
  ],
  "source": {
    "kind": "generated",
    "licence": "owned",
    "origin": "content/pictures/tools/sketch_pictures.py"
  },
  "structure": {
    "backgroundShare": 0.269,
    "nestingDepth": 4,
    "regionCount": 25
  },
  "subject": "Woodpecker 2",
  "tags": {
    "bands": ["regular"],
    "themes": ["animals", "forest"]
  },
  "version": 1,
  "width": 14
}
