{
  "finishedLook": {
    "mode": "auto"
  },
  "grid": [
    [6, 6, 6, 6, 6, 6, 6, 6, 6, 6, 6, 6, 6, 6],
    [6, 6, 6, 6, 6, 6, 6, 6, 6, 6, 6, 6, 6, 6],
    [0, 0, 0, 5, 5, 5, 5, 5, 0, 0, 0, 0, 0, -1],
    [0, 0, 0, 5, 0, -1, 0, 0, 0, 0, 0, 0, 0, 0],
    [0, 0, 0, 5, 0, 0, 5, 0, 0, 0, 0, 0, 0, 0],
    [-1, -1, 0, 5, -1, 0, 5, 0, 0, 0, -1, 0, 0, -1],
    [0, 0, -1, -1, 1, 1, 5, 0, 0, 0, -1, 0, -1, 0],
    [0, 0, 1, 1, 1, 1, 1, 1, 0, 0, 0, -1, 0, 0],
    [0, 0, 1, 2, 2, 1, 1, 1, 1, 1, 1, 0, 3, 0],
    [0, 0, 1, 2, 2, 1, 1, 1, 1, 1, 1, 1, 3, 3],
    [0, 0, 1, 2, 2, 1, 1, 1, 0, 0, 0, 0, 3, 3],
    [0, 0, -1, 0, 1, 1, 1, 0, 0, -1, 0, 0, 0, 0],
    [0, 0, 0, 0, 4, 4, 0, 0, 0, -1, -1, 0, 0, 0],
    [0, 0, 0, -1, 4, 4, 0, 0, 0, 0, 0, 0, 0, -1],
    [0, 0, -1, 0, 4, 0, 0, -1, -1, 7, 7, 7, 7, 0],
    [0, 0, 0, 0, 0, 0, 0, 0, 0, 7, 7, 7, 7, 0],
    [0, -1, 0, -1, -1, 0, 0, 0, 0, 0, 0, 0, 0, 0],
    [-1, -1, 0, -1, 0, -1, 0, -1, 0, 0, 0, 0, 0, -1]
  ],
  "height": 18,
  "id": "helicopter_03",
  "review": {
    "notes": "Approved by the automated picture checks (FR-084 as amended on 2026-10-06).",
    "reviewer": "automated picture checks",
    "status": "approved"
  },
  "roles": [
    {
      "colorGroup": "blue_cyan",
      "isBackground": true,
      "name": "Sky",
      "roleId": "sky"
    },
    {
      "colorGroup": "pink_purple",
      "name": "Body",
      "roleId": "body"
    },
    {
      "colorGroup": "blue_cyan",
      "name": "Windows",
      "roleId": "window"
    },
    {
      "colorGroup": "brown_orange",
      "name": "Tail rotor",
      "roleId": "tail"
    },
    {
      "colorGroup": "brown_orange",
      "name": "Mast",
      "roleId": "mast"
    },
    {
      "colorGroup": "pink_purple",
      "name": "Skids",
      "roleId": "skid"
    },
    {
      "colorGroup": "green",
      "name": "Grass",
      "roleId": "grass"
    },
    {
      "colorGroup": "green",
      "name": "Cloud",
      "roleId": "cloud"
    }
  ],
  "source": {
    "kind": "generated",
    "licence": "owned",
    "origin": "content/pictures/tools/sketch_pictures.py"
  },
  "structure": {
    "backgroundShare": 0.511,
    "nestingDepth": 4,
    "regionCount": 15
  },
  "subject": "Helicopter 3",
  "tags": {
    "bands": ["regular"],
    "themes": ["vehicles", "sky"]
  },
  "version": 1,
  "width": 14
}
