{
  "finishedLook": {
    "mode": "auto"
  },
  "grid": [
    [-1, -1, -1, -1, -1, -1, -1, -1, -1, -1, -1, -1, -1, -1, -1, -1, -1, -1, -1, -1, -1, -1],
    [-1, -1, 0, 0, 0, 0, 0, 0, 0, 0, 0, 0, 4, 0, 0, 0, 5, 0, 0, 0, -1, -1],
    [-1, 0, 0, 0, 0, 2, 2, 2, 0, 0, 0, 0, 0, 0, 0, 5, 5, 5, 0, 0, 0, -1],
    [-1, 0, 0, 0, 2, 2, 2, 0, 0, 0, 0, 0, 0, 0, 0, 0, 5, 0, 0, 0, 0, -1],
    [-1, 0, 0, 0, 0, 0, 0, 0, 5, 5, 3, 3, 3, 5, 0, 0, 0, 0, 0, 0, 0, -1],
    [-1, 0, 0, 0, 0, 0, 5, 5, 1, 1, 1, 1, 1, 1, 1, 1, 1, 0, 0, 0, 0, -1],
    [-1, 0, 0, 0, 0, 5, 5, 3, 1, 1, 1, 1, 1, 1, 1, 1, 1, 0, 0, 0, 0, -1],
    [-1, 0, 0, 0, 5, 5, 3, 3, 3, 3, 1, 1, 3, 3, 3, 3, 1, 1, 0, 0, 0, -1],
    [-1, 0, 0, 0, 5, 3, 3, 3, 3, 3, 1, 1, 3, 3, 3, 5, 1, 1, 0, 0, 0, -1],
    [-1, 0, 0, 5, 3, 3, 3, 3, 3, 3, 1, 1, 3, 3, 3, 2, 2, 2, 2, 2, 2, -1],
    [-1, 0, 0, 3, 3, 3, 3, 5, 3, 3, 1, 1, 3, 3, 4, 2, 2, 2, 2, 2, 2, -1],
    [-1, 0, 5, 3, 3, 4, 5, 5, 5, 3, 3, 3, 3, 4, 4, 4, 0, 2, 2, 2, 0, -1],
    [-1, 0, 3, 3, 4, 4, 4, 5, 5, 3, 3, 0, 4, 4, 4, 0, 0, 0, 0, 0, 0, -1],
    [-1, 0, 3, 3, 3, 4, 4, 4, 0, 3, 3, 4, 4, 4, 0, 0, 0, 0, 0, 0, 0, -1],
    [-1, 0, 3, 3, 3, 5, 4, 4, 4, 3, 3, 3, 4, 3, 0, 0, 0, 0, 0, 0, 0, -1],
    [-1, 0, 5, 3, 5, 5, 5, 4, 0, 3, 1, 1, 3, 3, 0, 0, 0, 0, 0, 0, 0, -1],
    [-1, 0, 5, 5, 5, 5, 5, 0, 0, 4, 1, 1, 0, 4, 0, 0, 0, 0, 0, 0, 0, -1],
    [-1, 0, 5, 5, 5, 5, 4, 4, 4, 4, 4, 4, 4, 4, 4, 0, 0, 0, 0, 0, 0, -1],
    [-1, 0, 0, 5, 5, 4, 4, 4, 0, 4, 4, 0, 4, 4, 4, 0, 0, 0, 0, 0, 0, -1],
    [-1, 0, 0, 5, 4, 4, 4, 0, 0, 0, 0, 0, 0, 4, 4, 4, 0, 0, 0, 0, 0, -1],
    [-1, 0, 0, 0, 4, 4, 5, 0, 0, 0, 0, 0, 0, 0, 4, 4, 4, 0, 0, 0, 0, -1],
    [-1, 0, 0, 0, 5, 5, 5, 0, 0, 0, 0, 0, 0, 0, 0, 4, 0, 0, 0, 0, 0, -1],
    [-1, 0, 0, 0, 0, 5, 5, 5, 0, 0, 0, 0, 0, 0, 0, 0, 0, 0, 0, 0, 0, -1],
    [-1, 0, 0, 4, 0, 0, 5, 5, 0, 0, 0, 0, 0, 0, 0, 0, 0, 5, 0, 0, 0, -1],
    [-1, 0, 4, 4, 4, 0, 0, 0, 5, 0, 0, 0, 0, 0, 0, 0, 0, 0, 0, 0, 0, -1],
    [-1, 0, 0, 4, 0, 0, 0, 0, 0, 0, 0, 0, 0, 0, 0, 0, 0, 0, 0, 0, 0, -1],
    [-1, -1, 0, 0, 0, 0, 0, 0, 0, 0, 0, 0, 0, 0, 0, 0, 0, 0, 0, 0, -1, -1],
    [-1, -1, -1, -1, -1, -1, -1, -1, -1, -1, -1, -1, -1, -1, -1, -1, -1, -1, -1, -1, -1, -1]
  ],
  "height": 28,
  "id": "story_crescent_cloud_mill",
  "review": {
    "notes": "Approved by the automated picture checks (FR-084 as amended on 2026-10-06).",
    "reviewer": "automated picture checks",
    "status": "approved"
  },
  "roles": [
    {
      "colorGroup": "blue_cyan",
      "isBackground": true,
      "name": "Небо / вода",
      "roleId": "sky"
    },
    {
      "colorGroup": "green",
      "name": "Глубокая зелень",
      "roleId": "shadow"
    },
    {
      "colorGroup": "green",
      "name": "Листва",
      "roleId": "leaf"
    },
    {
      "colorGroup": "brown_orange",
      "name": "Дерево / охра",
      "roleId": "wood"
    },
    {
      "colorGroup": "pink_purple",
      "name": "Розовый акцент",
      "roleId": "petal"
    },
    {
      "colorGroup": "lime",
      "name": "Лаймовый свет",
      "roleId": "light"
    }
  ],
  "source": {
    "kind": "generated_edited",
    "licence": "owned",
    "origin": "Original Bloomlings pilot-v2 concept; hand-authored exact target-cell grid. Reference: content/pictures/pilot-v2/references/concepts-v2.png"
  },
  "structure": {
    "backgroundShare": 0.465,
    "nestingDepth": 3,
    "regionCount": 29
  },
  "subject": "Лунная мельница",
  "tags": {
    "bands": ["big"],
    "themes": ["art-pilot-v2"]
  },
  "version": 1,
  "width": 22
}
