{
  "finishedLook": {
    "mode": "auto"
  },
  "grid": [
    [5, 5, 5, 5, 5, 5, 5, 5, 5, 5, 5, 5, 5, 5, 5],
    [5, 5, 5, 5, 5, 5, 5, 5, 5, 5, 5, 5, 5, 5, 5],
    [-1, 3, 4, 0, 0, 4, -1, 0, -1, 4, 0, 0, 4, 3, 0],
    [0, 3, 4, 0, 4, 3, 0, 0, 0, 3, 4, 0, 4, 3, 0],
    [-1, 3, 0, 4, 4, 3, 0, 0, -1, 3, 4, 4, 0, 3, -1],
    [-1, 3, 0, 0, 0, 3, 0, -1, 0, 3, 0, 0, 0, 3, 0],
    [0, 3, 0, 0, 0, 3, 0, 0, 0, 3, 0, 0, 0, 3, -1],
    [0, 3, -1, -1, 0, 3, 0, 0, 0, 3, -1, 0, -1, 3, 0],
    [0, 3, 0, 0, 0, 3, 0, 0, 0, 3, 0, 0, 0, 3, 0],
    [0, 3, 0, 0, 0, 3, 0, 0, -1, 1, 0, -1, 0, 3, 0],
    [0, 3, -1, -1, -1, 2, 2, 0, 1, 1, 1, 0, 2, 2, -1],
    [-1, 1, 1, 0, 2, 2, 2, -1, 1, 1, 1, 0, 2, 2, -1],
    [0, 1, 1, 0, 2, 2, -1, 0, 0, 0, -1, -1, 0, 0, 0],
    [0, 0, 0, -1, 0, 0, 0, -1, 0, 0, 0, -1, 0, 0, 0],
    [0, -1, 0, 0, 0, 0, 0, 0, 0, 0, 0, 0, 0, 0, 0],
    [0, 0, 0, 0, -1, 0, 0, 0, -1, 0, -1, 0, 6, 6, 0],
    [0, 0, 0, 0, 0, 0, 0, 0, -1, 0, -1, 0, 6, 6, -1],
    [-1, 0, -1, 0, 0, -1, -1, 0, 0, 0, 0, -1, 6, 6, -1]
  ],
  "height": 18,
  "id": "tulip_bed_12",
  "review": {
    "notes": "Approved by the automated picture checks (FR-084 as amended on 2026-10-06).",
    "reviewer": "automated picture checks",
    "status": "approved"
  },
  "roles": [
    {
      "colorGroup": "blue_cyan",
      "isBackground": true,
      "name": "Sky",
      "roleId": "sky"
    },
    {
      "colorGroup": "red",
      "name": "Red tulips",
      "roleId": "tulip"
    },
    {
      "colorGroup": "pink_purple",
      "name": "Other tulips",
      "roleId": "tulip2"
    },
    {
      "colorGroup": "green",
      "name": "Stems",
      "roleId": "stem"
    },
    {
      "colorGroup": "green",
      "name": "Leaves",
      "roleId": "leaf"
    },
    {
      "colorGroup": "brown_orange",
      "name": "Soil",
      "roleId": "soil"
    },
    {
      "colorGroup": "brown_orange",
      "name": "Sun",
      "roleId": "sun"
    }
  ],
  "source": {
    "kind": "generated",
    "licence": "owned",
    "origin": "content/pictures/tools/sketch_pictures.py"
  },
  "structure": {
    "backgroundShare": 0.477,
    "nestingDepth": 4,
    "regionCount": 29
  },
  "subject": "Tulip bed 12",
  "tags": {
    "bands": ["regular"],
    "themes": ["flowers", "garden"]
  },
  "version": 1,
  "width": 15
}
