{
  "finishedLook": {
    "mode": "auto"
  },
  "grid": [
    [8, 8, 8, 8, 8, 8, 8, 8, 8, 8, 8, 8, 8, 8, 8],
    [8, 8, 8, 8, 8, 8, 8, 8, 8, 8, 8, 8, 8, 8, 8],
    [8, 8, 8, 8, 8, 8, 8, 8, 8, 8, 1, 1, 1, 1, 8],
    [5, 5, 5, 5, 0, 0, -1, 0, 0, -1, 1, 1, 1, 1, 0],
    [5, 5, 5, 5, 0, 0, -1, 0, 0, -1, 0, 1, 0, 0, 0],
    [4, 4, 4, 4, 0, -1, -1, 0, 0, 0, -1, 1, -1, 0, 0],
    [-1, 4, 4, 4, -1, 0, 0, -1, 0, -1, 1, 0, -1, 0, 0],
    [0, 4, 4, 4, 4, 0, 0, 0, -1, 0, 1, 0, 0, 0, 0],
    [0, -1, 4, 4, 4, 0, 0, 0, -1, 0, 1, 0, 0, 0, -1],
    [0, 0, 4, 3, 3, 0, -1, 2, 2, 2, 2, 0, -1, 0, 0],
    [0, 0, 3, 3, 3, 1, 1, 0, 1, 1, 0, 0, -1, 0, 0],
    [0, 0, 1, 1, 1, 1, 1, 1, 1, 6, 6, 6, 6, 6, -1],
    [-1, 0, 0, 1, 1, 1, 1, 0, -1, 6, 7, 6, 7, 6, 0],
    [0, 0, 0, 0, 1, 2, -1, 0, 0, 6, 7, 6, 7, 6, 0],
    [0, 0, 0, 0, 0, 0, 0, -1, 0, 6, 7, 6, 7, 6, 0],
    [-1, 0, -1, -1, 0, 0, 0, -1, 0, 6, 6, 6, 6, 6, 0],
    [-1, 0, 0, 0, 0, 0, 0, 0, 0, 0, 0, 0, 0, 0, -1]
  ],
  "height": 17,
  "id": "desk_lamp_08",
  "review": {
    "notes": "Approved by the automated picture checks (FR-084 as amended on 2026-10-06).",
    "reviewer": "automated picture checks",
    "status": "approved"
  },
  "roles": [
    {
      "colorGroup": "blue_cyan",
      "isBackground": true,
      "name": "Wall",
      "roleId": "wall"
    },
    {
      "colorGroup": "red",
      "name": "Red lamp",
      "roleId": "lamp"
    },
    {
      "colorGroup": "brown_orange",
      "name": "Joints",
      "roleId": "joint"
    },
    {
      "colorGroup": "brown_orange",
      "name": "Bulb",
      "roleId": "bulb"
    },
    {
      "colorGroup": "green",
      "name": "Light",
      "roleId": "beam"
    },
    {
      "colorGroup": "pink_purple",
      "name": "Book",
      "roleId": "book"
    },
    {
      "colorGroup": "brown_orange",
      "name": "Window frame",
      "roleId": "frame"
    },
    {
      "colorGroup": "blue_cyan",
      "name": "Window",
      "roleId": "window"
    },
    {
      "colorGroup": "brown_orange",
      "name": "Desk",
      "roleId": "desk"
    }
  ],
  "source": {
    "kind": "generated",
    "licence": "owned",
    "origin": "content/pictures/tools/sketch_pictures.py"
  },
  "structure": {
    "backgroundShare": 0.376,
    "nestingDepth": 4,
    "regionCount": 21
  },
  "subject": "Desk lamp 8",
  "tags": {
    "bands": ["regular"],
    "themes": ["things", "desk"]
  },
  "version": 1,
  "width": 15
}
