{
  "finishedLook": {
    "mode": "auto"
  },
  "grid": [
    [-1, -1, -1, -1, -1, -1, -1, -1, -1, -1, -1, -1, -1, -1, -1, -1, -1, -1, -1, -1, -1],
    [-1, -1, 0, 0, 0, 0, 0, 0, 0, 0, 0, 0, 0, 0, 0, 0, 0, 0, 0, -1, -1],
    [-1, 0, 0, 0, 0, 0, 0, 0, 0, 0, 0, 0, 0, 0, 0, 0, 0, 0, 0, 0, -1],
    [-1, 0, 0, 0, 0, 0, 0, 0, 0, 0, 0, 0, 0, 0, 0, 0, 0, 0, 0, 0, -1],
    [-1, 0, 0, 0, 0, 0, 0, 0, 0, 0, 1, 1, 1, 1, 0, 0, 0, 0, 0, 0, -1],
    [-1, 0, 0, 0, 0, 1, 1, 1, 1, 1, 1, 0, 1, 3, 3, 1, 0, 0, 0, 0, -1],
    [-1, 0, 0, 1, 1, 1, 1, 1, 1, 1, 1, 3, 3, 3, 3, 1, 1, 0, 0, 0, -1],
    [-1, 0, 1, 1, 1, 1, 1, 1, 1, 1, 3, 3, 3, 3, 3, 1, 1, 0, 0, 0, -1],
    [-1, 0, 1, 1, 1, 3, 3, 1, 1, 3, 3, 3, 3, 3, 1, 1, 1, 1, 0, 0, -1],
    [-1, 0, 1, 1, 3, 3, 3, 3, 3, 3, 3, 3, 3, 1, 1, 1, 1, 1, 1, 0, -1],
    [-1, 0, 3, 3, 3, 3, 3, 3, 3, 3, 3, 3, 3, 3, 1, 1, 1, 1, 1, 0, -1],
    [-1, 0, 3, 3, 3, 3, 3, 3, 3, 2, 3, 3, 3, 3, 3, 3, 3, 1, 1, 0, -1],
    [-1, 0, 3, 3, 3, 3, 3, 3, 3, 2, 2, 3, 3, 3, 3, 3, 3, 3, 0, 0, -1],
    [-1, 0, 0, 1, 1, 3, 3, 3, 3, 2, 2, 2, 3, 3, 3, 3, 3, 3, 3, 0, -1],
    [-1, 0, 1, 1, 1, 3, 3, 3, 3, 2, 2, 2, 3, 3, 3, 3, 3, 3, 3, 0, -1],
    [-1, 0, 1, 1, 3, 3, 3, 3, 3, 2, 2, 2, 3, 3, 3, 3, 3, 3, 3, 0, -1],
    [-1, 0, 1, 1, 3, 3, 3, 3, 3, 3, 3, 3, 3, 3, 3, 3, 3, 3, 3, 0, -1],
    [-1, 0, 1, 1, 3, 3, 3, 3, 3, 3, 3, 3, 3, 3, 3, 0, 3, 3, 3, 0, -1],
    [-1, 0, 1, 1, 3, 3, 0, 3, 3, 3, 3, 3, 3, 3, 3, 0, 0, 0, 0, 0, -1],
    [-1, 0, 1, 1, 0, 0, 0, 3, 3, 3, 3, 3, 3, 3, 0, 0, 0, 0, 0, 0, -1],
    [-1, 0, 0, 0, 0, 0, 0, 0, 3, 3, 3, 3, 3, 3, 0, 0, 0, 0, 0, 0, -1],
    [-1, 0, 0, 0, 0, 0, 0, 0, 0, 3, 3, 3, 3, 0, 0, 0, 0, 0, 0, 0, -1],
    [-1, 0, 0, 0, 0, 0, 0, 0, 0, 0, 0, 0, 0, 0, 0, 0, 0, 0, 0, 0, -1],
    [-1, 0, 0, 0, 0, 0, 0, 0, 0, 0, 0, 0, 0, 0, 0, 0, 0, 0, 0, 0, -1],
    [-1, -1, 0, 0, 0, 0, 0, 0, 0, 0, 0, 0, 0, 0, 0, 0, 0, 0, 0, -1, -1],
    [-1, -1, -1, -1, -1, -1, -1, -1, -1, -1, -1, -1, -1, -1, -1, -1, -1, -1, -1, -1, -1]
  ],
  "height": 26,
  "id": "magnolia",
  "review": {
    "notes": "Approved by the automated picture checks (FR-084 as amended on 2026-10-06).",
    "reviewer": "automated picture checks",
    "status": "approved"
  },
  "roles": [
    {
      "colorGroup": "blue_cyan",
      "isBackground": true,
      "name": "sky",
      "roleId": "sky"
    },
    {
      "colorGroup": "green",
      "name": "leaf",
      "roleId": "leaf"
    },
    {
      "colorGroup": "brown_orange",
      "name": "wood",
      "roleId": "wood"
    },
    {
      "colorGroup": "pink_purple",
      "name": "petal",
      "roleId": "petal"
    }
  ],
  "source": {
    "kind": "generated_edited",
    "licence": "owned",
    "origin": "content/launch-art/references/atlas-0010.png panel 15; quantized exact target-cell authoring grid; one-cell entry clearance"
  },
  "structure": {
    "backgroundShare": 0.388,
    "nestingDepth": 3,
    "regionCount": 7
  },
  "subject": "Magnolia",
  "tags": {
    "bands": ["big"],
    "themes": ["launch-original"]
  },
  "version": 1,
  "width": 21
}
