{
  "finishedLook": {
    "mode": "auto"
  },
  "grid": [
    [-1, -1, -1, -1, -1, -1, -1, -1, -1, -1, -1, -1, -1, -1, -1, -1, -1, -1, -1, -1, -1, -1, -1, -1],
    [-1, -1, 0, 0, 0, 0, 0, 0, 0, 0, 0, 0, 0, 0, 0, 0, 0, 0, 0, 0, 0, 0, -1, -1],
    [-1, 0, 1, 0, 0, 0, 0, 0, 0, 0, 0, 0, 1, 1, 1, 1, 1, 1, 1, 1, 0, 0, 0, -1],
    [-1, 0, 1, 3, 1, 1, 0, 1, 1, 1, 1, 1, 1, 3, 1, 1, 1, 3, 1, 1, 0, 0, 0, -1],
    [-1, 0, 1, 3, 1, 3, 1, 1, 1, 1, 1, 1, 1, 3, 1, 1, 1, 1, 3, 0, 0, 0, 0, -1],
    [-1, 0, 3, 1, 1, 3, 1, 1, 1, 1, 1, 1, 1, 1, 1, 1, 1, 1, 1, 0, 0, 0, 0, -1],
    [-1, 0, 3, 1, 1, 1, 1, 1, 1, 1, 1, 1, 1, 1, 3, 1, 1, 1, 0, 0, 0, 0, 0, -1],
    [-1, 0, 1, 1, 1, 1, 1, 1, 1, 1, 3, 1, 1, 1, 1, 3, 3, 0, 0, 0, 0, 0, 0, -1],
    [-1, 0, 0, 1, 1, 1, 1, 1, 1, 1, 3, 1, 1, 1, 1, 1, 2, 2, 0, 0, 0, 0, 0, -1],
    [-1, 0, 0, 0, 1, 1, 1, 1, 1, 1, 1, 3, 1, 1, 1, 2, 2, 2, 2, 0, 0, 0, 0, -1],
    [-1, 0, 0, 0, 0, 0, 1, 1, 1, 1, 1, 1, 1, 1, 2, 2, 0, 2, 2, 2, 0, 0, 0, -1],
    [-1, 0, 0, 0, 0, 0, 0, 1, 1, 1, 1, 0, 0, 2, 2, 2, 0, 2, 2, 2, 2, 2, 0, -1],
    [-1, 0, 0, 0, 0, 0, 0, 0, 0, 0, 0, 0, 2, 2, 2, 2, 0, 2, 2, 2, 2, 2, 0, -1],
    [-1, 0, 0, 0, 0, 0, 0, 2, 2, 2, 2, 2, 2, 2, 2, 2, 0, 0, 2, 0, 2, 2, 0, -1],
    [-1, 0, 0, 0, 0, 0, 2, 2, 2, 2, 2, 2, 2, 2, 2, 2, 0, 0, 0, 0, 0, 2, 0, -1],
    [-1, 0, 0, 0, 0, 2, 2, 2, 2, 0, 2, 2, 2, 0, 2, 2, 2, 2, 2, 0, 0, 0, 0, -1],
    [-1, 0, 0, 0, 0, 2, 2, 2, 0, 0, 2, 2, 2, 0, 2, 2, 2, 2, 2, 2, 0, 0, 0, -1],
    [-1, 0, 0, 0, 0, 0, 2, 0, 0, 2, 2, 2, 0, 0, 2, 2, 2, 2, 2, 2, 2, 0, 0, -1],
    [-1, 0, 0, 0, 0, 0, 0, 0, 0, 2, 2, 2, 0, 0, 2, 2, 2, 0, 0, 2, 2, 0, 0, -1],
    [-1, 0, 0, 0, 0, 0, 0, 0, 0, 2, 2, 0, 0, 0, 2, 2, 2, 2, 0, 0, 0, 0, 0, -1],
    [-1, 0, 0, 0, 0, 0, 0, 0, 0, 0, 0, 0, 0, 2, 2, 2, 2, 2, 0, 0, 0, 0, 0, -1],
    [-1, 0, 0, 0, 0, 0, 0, 0, 0, 0, 0, 0, 0, 0, 2, 2, 2, 2, 0, 0, 0, 0, 0, -1],
    [-1, -1, 0, 0, 0, 0, 0, 0, 0, 0, 0, 0, 0, 0, 0, 0, 0, 0, 0, 0, 0, 0, -1, -1],
    [-1, -1, -1, -1, -1, -1, -1, -1, -1, -1, -1, -1, -1, -1, -1, -1, -1, -1, -1, -1, -1, -1, -1, -1]
  ],
  "height": 24,
  "id": "croissant_coral_harbor",
  "review": {
    "notes": "Approved by the automated picture checks (FR-084 as amended on 2026-10-06).",
    "reviewer": "automated picture checks",
    "status": "approved"
  },
  "roles": [
    {
      "colorGroup": "blue_cyan",
      "isBackground": true,
      "name": "sky",
      "roleId": "sky"
    },
    {
      "colorGroup": "brown_orange",
      "name": "wood",
      "roleId": "wood"
    },
    {
      "colorGroup": "pink_purple",
      "name": "petal",
      "roleId": "petal"
    },
    {
      "colorGroup": "lime",
      "name": "light",
      "roleId": "light"
    }
  ],
  "source": {
    "kind": "generated_edited",
    "licence": "owned",
    "origin": "content/launch-art/references/atlas-0084.png panel 3; quantized exact target-cell authoring grid; one-cell entry clearance"
  },
  "structure": {
    "backgroundShare": 0.423,
    "nestingDepth": 3,
    "regionCount": 14
  },
  "subject": "Croissant Coral Harbor",
  "tags": {
    "bands": ["big"],
    "themes": ["launch-original"]
  },
  "version": 1,
  "width": 24
}
