{
  "finishedLook": {
    "mode": "auto"
  },
  "grid": [
    [6, 6, 6, 6, 6, 6, 6, 6, 6, 6, 6, 6, 6, 6, 6, 6, 6, 6, 6, 6, 6, 6],
    [6, 6, 6, 6, 6, 6, 6, 6, 6, 6, 6, 6, 6, 6, 6, 6, 6, 6, 6, 6, 6, 6],
    [6, 6, 6, 6, 6, 6, 6, 6, 6, 6, 6, 6, 6, 6, 6, 6, 6, 6, 6, 8, 8, 6],
    [7, 7, 7, 4, 4, 4, 4, 4, 4, 4, 4, 4, 4, 4, 4, 4, 4, 7, 7, 8, 8, 7],
    [7, 7, 7, 7, 7, 2, 2, 2, 3, 3, 3, 3, 2, 2, 2, 7, 7, 7, 7, 8, 7, 7],
    [7, 7, 7, 7, 7, 2, 2, 2, 2, 3, 3, 2, 2, 2, 2, 7, 7, 7, 7, 8, 7, 7],
    [7, 1, 1, 1, 1, 1, 1, 1, 1, 1, 1, 1, 1, 1, 1, 1, 1, 1, 1, 8, 7, 7],
    [7, 1, 7, 1, 1, 1, 1, 1, 1, 1, 1, 1, 1, 1, 1, 1, 1, 1, 1, 8, 7, 7],
    [-1, 0, 7, 7, 1, 1, 1, 1, 1, 1, 1, 1, 1, 1, 1, 1, 0, 0, 9, 9, 9, 9],
    [0, 0, 0, 0, 7, 7, 2, 2, 3, 2, 2, 3, 2, 2, 0, -1, 0, 9, 9, 9, 9, 9],
    [0, 0, 0, -1, -1, -1, 2, 2, 3, 2, 2, 3, 2, 2, -1, 0, 0, 9, 9, 9, 9, 9],
    [0, 0, 1, 1, 1, 1, 1, 1, 1, 1, 1, 1, 1, 1, 1, 1, 1, 1, 9, 9, 9, 9],
    [0, -1, 1, 0, 1, 1, 1, 1, 1, 1, 1, 1, 1, 1, 1, 1, 0, 1, 9, 9, 9, 9],
    [0, 0, 0, 0, -1, 1, 1, 1, 1, 1, 1, 1, 1, 1, 1, 0, 0, 0, -1, 9, 9, 0],
    [0, 0, 0, -1, 0, 0, 0, 2, 3, 2, 2, 3, 2, 0, -1, 0, 0, -1, 0, 0, -1, 0],
    [0, -1, 0, 0, 0, 0, 0, 2, 3, 2, 2, 3, 2, -1, -1, 0, 0, 0, -1, 0, 0, -1],
    [0, 0, 0, 1, 1, 1, 1, 1, 1, 1, 1, 1, 1, 1, 1, 1, 1, 0, -1, -1, 0, 0],
    [0, 0, -1, 1, 0, 1, 1, 1, 1, 1, 1, 1, 1, 1, 1, -1, 1, 0, -1, 0, 0, 0],
    [0, 0, 0, 0, -1, 0, 1, 1, 1, 1, 1, 1, 1, 1, 0, -1, -1, 0, 0, -1, -1, 0],
    [0, -1, 0, 0, 0, 0, 0, 0, 2, 3, 3, 2, 0, 0, 0, 0, 0, -1, 0, 0, 0, -1],
    [0, 0, -1, 0, 0, -1, 0, -1, 2, 3, 3, 2, -1, 0, 0, 0, 0, 0, -1, 0, 0, 0],
    [-1, 0, 0, 0, 1, 1, 1, 1, 1, 1, 1, 1, 1, 1, 1, 1, 0, 0, 0, 0, 0, 0],
    [0, 0, 0, 0, 1, 0, 1, 1, 1, 1, 1, 1, 1, 1, -1, 1, 0, 0, 0, 0, 0, 0],
    [0, 0, 5, 5, -1, 0, 0, 1, 1, 4, 4, 1, 1, 0, 0, 0, 0, 0, 0, -1, 0, 0],
    [0, 5, 5, 5, 0, 0, 0, 0, -1, 4, 4, 0, 0, 0, 0, 0, 0, 0, 0, 0, 0, -1],
    [0, 5, 5, 5, 5, 0, -1, 0, 0, 4, 4, -1, 0, -1, 0, -1, -1, 0, 0, 0, -1, -1],
    [-1, 5, 5, 5, -1, -1, 0, 0, 4, 4, 4, 4, -1, 0, 0, 0, 0, -1, -1, 0, 0, 0],
    [-1, 0, 0, 0, 0, 0, 0, 0, 0, 0, 0, 0, 0, 0, -1, -1, -1, 0, 0, 0, 0, -1]
  ],
  "height": 28,
  "id": "pagoda_02",
  "review": {
    "notes": "Approved by the automated picture checks (FR-084 as amended on 2026-10-06).",
    "reviewer": "automated picture checks",
    "status": "approved"
  },
  "roles": [
    {
      "colorGroup": "blue_cyan",
      "isBackground": true,
      "name": "Sky",
      "roleId": "sky"
    },
    {
      "colorGroup": "pink_purple",
      "name": "Roofs",
      "roleId": "roof"
    },
    {
      "colorGroup": "brown_orange",
      "name": "Walls",
      "roleId": "wall"
    },
    {
      "colorGroup": "blue_cyan",
      "name": "Windows and door",
      "roleId": "window"
    },
    {
      "colorGroup": "brown_orange",
      "name": "Spire and steps",
      "roleId": "spire"
    },
    {
      "colorGroup": "brown_orange",
      "name": "Sun",
      "roleId": "sun"
    },
    {
      "colorGroup": "green",
      "name": "Grass",
      "roleId": "grass"
    },
    {
      "colorGroup": "green",
      "name": "Mountain and hills",
      "roleId": "mountain"
    },
    {
      "colorGroup": "brown_orange",
      "name": "Trunk",
      "roleId": "trunk"
    },
    {
      "colorGroup": "pink_purple",
      "name": "Blossom",
      "roleId": "blossom"
    }
  ],
  "source": {
    "kind": "generated",
    "licence": "owned",
    "origin": "content/pictures/tools/sketch_pictures.py"
  },
  "structure": {
    "backgroundShare": 0.295,
    "nestingDepth": 5,
    "regionCount": 39
  },
  "subject": "Pagoda 2",
  "tags": {
    "bands": ["daily"],
    "themes": ["places", "travel", "daily"]
  },
  "version": 1,
  "width": 22
}
