{
  "finishedLook": {
    "mode": "auto"
  },
  "grid": [
    [5, 5, 5, 5, 5, 5, 5, 5, 5, 5, 5, 5, 5, 5, 5],
    [5, 5, 7, 7, 7, 7, 7, 7, 7, 7, 7, 7, 7, 5, 5],
    [0, 7, 7, 7, 7, 7, 7, 7, 7, 7, 7, 7, 7, 7, -1],
    [-1, 0, 1, 1, 1, 1, 1, 1, 1, 1, 1, 1, 1, -1, 0],
    [0, 0, 1, 1, 1, 1, 1, 1, 1, 1, 1, 1, 1, 0, 0],
    [0, -1, 1, 6, 1, 1, 1, 1, 1, 1, 1, 6, 1, 0, -1],
    [0, -1, 0, -1, 1, 1, 6, 1, 6, 1, 1, 0, 0, 0, 0],
    [0, -1, 0, -1, 1, 6, 0, 1, 0, 6, 1, 0, 0, -1, 0],
    [-1, 0, 0, 0, 0, 0, 0, -1, 0, 0, 0, 0, 0, 0, 0],
    [0, 0, 0, 0, -1, 4, 0, 0, 0, 4, 0, 0, 0, 0, 0],
    [0, -1, -1, 0, 0, 4, 0, 0, -1, 0, 4, 0, -1, 0, 0],
    [-1, 0, 0, 3, 0, 4, 0, 0, 0, -1, 4, 0, 0, 0, 0],
    [0, 0, 3, 3, -1, 4, 0, -1, -1, 4, 0, 0, 0, -1, -1],
    [3, 3, 3, 3, 3, -1, 0, 0, 0, -1, -1, 0, 0, -1, 0],
    [0, 2, 2, 2, 0, 0, 0, 0, 0, 0, 0, 0, 0, 0, -1],
    [0, 2, 2, 2, 0, 0, -1, 0, 0, 0, 0, -1, 0, -1, -1],
    [-1, 0, 0, -1, 0, -1, 0, 0, 0, 0, -1, -1, 0, 0, -1]
  ],
  "height": 17,
  "id": "dumpling_01",
  "review": {
    "notes": "Approved by the automated picture checks (FR-084 as amended on 2026-10-06).",
    "reviewer": "automated picture checks",
    "status": "approved"
  },
  "roles": [
    {
      "colorGroup": "pink_purple",
      "isBackground": true,
      "name": "Wall",
      "roleId": "wall"
    },
    {
      "colorGroup": "blue_cyan",
      "name": "Dumplings",
      "roleId": "dumpling"
    },
    {
      "colorGroup": "blue_cyan",
      "name": "Wall dots and jars",
      "roleId": "wall_dots"
    },
    {
      "colorGroup": "blue_cyan",
      "name": "Shelf",
      "roleId": "shelf"
    },
    {
      "colorGroup": "blue_cyan",
      "name": "Steam",
      "roleId": "steam"
    },
    {
      "colorGroup": "brown_orange",
      "name": "Table",
      "roleId": "table"
    },
    {
      "colorGroup": "brown_orange",
      "name": "Pleats",
      "roleId": "pleats"
    },
    {
      "colorGroup": "green",
      "name": "Plate",
      "roleId": "plate"
    }
  ],
  "source": {
    "kind": "generated",
    "licence": "owned",
    "origin": "content/pictures/tools/sketch_pictures.py"
  },
  "structure": {
    "backgroundShare": 0.415,
    "nestingDepth": 4,
    "regionCount": 23
  },
  "subject": "Dumpling 1",
  "tags": {
    "bands": ["regular"],
    "themes": ["food", "dinner"]
  },
  "version": 1,
  "width": 15
}
