{
  "finishedLook": {
    "mode": "auto"
  },
  "grid": [
    [7, 7, 7, 7, 7, 7, 7, 7, 7, 7, 7, 7, 7, 7, 7, 7],
    [8, 8, 8, 8, 7, 7, 8, 7, 2, 2, 8, 7, 7, 7, 7, 7],
    [8, 8, 8, 8, 8, 0, 8, 0, 2, 2, 8, 0, 0, 0, 0, 0],
    [0, 8, 8, 8, 0, 0, 6, -1, 2, 2, 6, 0, 0, 0, 0, -1],
    [-1, 0, 0, 0, 0, 0, 6, 6, 2, 2, 6, 0, 0, 0, 0, 0],
    [0, 0, 0, -1, 0, 0, -1, 0, 2, 2, -1, -1, 0, 0, 0, 0],
    [0, -1, 0, 0, 0, 0, 0, -1, 2, 2, 0, 0, -1, 0, 0, 0],
    [0, 0, 0, -1, 0, 0, 0, 0, 2, 2, 0, 0, 0, 0, 0, -1],
    [0, 0, 0, 5, 5, 4, 4, 4, 4, 4, 4, 4, -1, 0, 0, -1],
    [0, 0, 0, 5, 5, 5, 4, 4, 4, 4, 4, 3, 4, -1, 0, 0],
    [-1, 0, 0, 5, 5, 5, 4, 4, 4, 4, 4, 3, 4, 0, 0, -1],
    [0, 0, -1, 0, -1, 4, 4, 4, 4, 4, 4, 3, 0, 0, -1, 0],
    [0, -1, 0, -1, -1, 0, -1, -1, 0, 0, 0, 3, 3, 3, -1, 0],
    [0, 1, 1, 0, -1, 9, 9, 9, 9, 0, 0, 3, 3, 3, 0, 0],
    [0, 1, 1, 0, -1, 9, 9, 9, 9, 0, 0, 0, 0, 0, 0, -1],
    [-1, 1, 1, 0, -1, 0, -1, 9, -1, 0, -1, -1, 0, 0, 0, -1]
  ],
  "height": 16,
  "id": "mailbox_06",
  "review": {
    "notes": "Approved by the automated picture checks (FR-084 as amended on 2026-10-06).",
    "reviewer": "automated picture checks",
    "status": "approved"
  },
  "roles": [
    {
      "colorGroup": "blue_cyan",
      "isBackground": true,
      "name": "Sky",
      "roleId": "sky"
    },
    {
      "colorGroup": "lime",
      "name": "Sun",
      "roleId": "sun"
    },
    {
      "colorGroup": "brown_orange",
      "name": "Post",
      "roleId": "post"
    },
    {
      "colorGroup": "brown_orange",
      "name": "Flag",
      "roleId": "flag"
    },
    {
      "colorGroup": "pink_purple",
      "name": "Mailbox",
      "roleId": "box"
    },
    {
      "colorGroup": "blue_cyan",
      "name": "Mailbox door",
      "roleId": "door"
    },
    {
      "colorGroup": "pink_purple",
      "name": "Flowers",
      "roleId": "flowers"
    },
    {
      "colorGroup": "green",
      "name": "Lawn",
      "roleId": "lawn"
    },
    {
      "colorGroup": "green",
      "name": "Bush and stems",
      "roleId": "bush"
    },
    {
      "colorGroup": "blue_cyan",
      "name": "Cloud",
      "roleId": "cloud"
    }
  ],
  "source": {
    "kind": "generated",
    "licence": "owned",
    "origin": "content/pictures/tools/sketch_pictures.py"
  },
  "structure": {
    "backgroundShare": 0.406,
    "nestingDepth": 4,
    "regionCount": 24
  },
  "subject": "Mailbox 6",
  "tags": {
    "bands": ["regular"],
    "themes": ["town", "cozy"]
  },
  "version": 1,
  "width": 16
}
