{
  "finishedLook": {
    "mode": "auto"
  },
  "grid": [
    [9, 9, 9, 9, 9, 9, 9, 9, 9, 9, 9, 9, 9, 9, 9],
    [9, 9, 9, 9, 9, 9, 9, 9, 9, 9, 9, 9, 8, 8, 9],
    [-1, 0, 0, 0, 5, 5, 5, -1, -1, -1, 0, 8, 8, 8, 0],
    [2, 2, 2, 2, 2, 5, 5, 2, 0, 0, 0, 0, 8, 0, 0],
    [0, 2, 2, 2, 2, 2, 7, 7, 2, 2, 2, 2, 0, 0, 0],
    [-1, 0, 0, 0, -1, 0, 7, 7, 0, 0, 0, 2, 0, 0, 0],
    [0, 0, 0, 0, 0, 0, 4, 7, 3, -1, -1, -1, 0, 0, -1],
    [0, 0, 0, 0, 0, 4, 4, 4, 3, 0, 0, 0, -1, 0, 0],
    [0, 0, 0, 0, 3, 4, 4, 4, 3, 0, 0, 0, 0, -1, 0],
    [0, 0, 0, 0, 3, 4, 4, 3, 3, -1, 0, 0, 0, 0, -1],
    [-1, -1, 0, 0, 0, 3, 3, 3, 3, 3, 0, 0, 0, -1, -1],
    [0, -1, 0, 0, 0, 3, 3, 3, 7, 6, 6, 1, 1, 0, 0],
    [-1, 0, 1, 1, 1, 3, 3, 3, 7, 6, 6, 1, 1, 1, -1],
    [0, 1, 1, 1, 1, 3, 3, 3, 3, 3, 6, 0, 0, 0, 0],
    [0, 0, 1, 0, 0, 0, 0, 3, 3, 0, 0, 0, 0, 0, 0],
    [-1, 0, 0, 0, -1, 0, 0, 0, 0, 0, 0, 0, 0, -1, -1]
  ],
  "height": 16,
  "id": "parrot_02",
  "review": {
    "notes": "Approved by the automated picture checks (FR-084 as amended on 2026-10-06).",
    "reviewer": "automated picture checks",
    "status": "approved"
  },
  "roles": [
    {
      "colorGroup": "blue_cyan",
      "isBackground": true,
      "name": "Sky",
      "roleId": "sky"
    },
    {
      "colorGroup": "green",
      "name": "Leaves",
      "roleId": "leaves"
    },
    {
      "colorGroup": "brown_orange",
      "name": "Branch",
      "roleId": "branch"
    },
    {
      "colorGroup": "pink_purple",
      "name": "Parrot",
      "roleId": "parrot"
    },
    {
      "colorGroup": "blue_cyan",
      "name": "Wing",
      "roleId": "wing"
    },
    {
      "colorGroup": "brown_orange",
      "name": "Tail",
      "roleId": "tail"
    },
    {
      "colorGroup": "brown_orange",
      "name": "Beak",
      "roleId": "beak"
    },
    {
      "colorGroup": "pink_purple",
      "name": "Eye and feet",
      "roleId": "eye"
    },
    {
      "colorGroup": "pink_purple",
      "name": "Flowers",
      "roleId": "flowers"
    },
    {
      "colorGroup": "green",
      "name": "Ferns",
      "roleId": "ferns"
    }
  ],
  "source": {
    "kind": "generated",
    "licence": "owned",
    "origin": "content/pictures/tools/sketch_pictures.py"
  },
  "structure": {
    "backgroundShare": 0.42,
    "nestingDepth": 4,
    "regionCount": 25
  },
  "subject": "Parrot 2",
  "tags": {
    "bands": ["regular"],
    "themes": ["animals", "jungle"]
  },
  "version": 1,
  "width": 15
}
