{
  "finishedLook": {
    "mode": "auto"
  },
  "grid": [
    [1, 1, 1, 1, 1, 1, 1, 1, 1, 1, 1, 1, 1, 1, 10, 10, 10, 10, 10, 10, 10, 10],
    [1, 1, 1, 1, 1, 1, 1, 1, 1, 1, 1, 1, 1, 1, 10, 10, 10, 10, 10, 10, 10, 10],
    [1, 1, 1, 1, 1, 1, 1, 1, 1, 1, 1, 1, 1, 1, 1, 10, 10, 10, 10, 10, 10, 10],
    [1, 1, 1, 1, 1, 1, 1, 1, 3, 1, 1, 3, 1, 1, 3, 10, 10, 3, 10, 10, 10, 10],
    [1, 9, 9, 9, 9, 9, 1, 1, 3, 1, 1, 3, 1, 1, 3, 1, 10, 3, 10, 10, 10, 10],
    [1, 9, 9, 9, 9, 9, 1, 1, 3, 1, 1, 3, 1, 1, 3, 1, 10, 3, 10, 10, 10, 10],
    [1, 1, 1, 3, 1, 3, 1, 1, 3, 1, 1, 3, 1, 1, 3, 1, 1, 3, 10, 10, 10, 10],
    [1, 9, 9, 3, 1, 3, 1, 1, 3, 1, 1, 3, 1, 1, 3, 1, 1, 3, 10, 10, 10, 10],
    [1, 9, 9, 3, 1, 3, 7, 7, 3, 1, 1, 3, 1, 1, 3, 1, 1, 3, 1, 1, 10, 10],
    [1, 1, 9, 3, 1, 2, 7, 2, 2, 2, 2, 2, 2, 2, 2, 2, 2, 2, 2, 2, 2, 2],
    [1, 1, 9, 3, 1, 3, 7, 7, 3, 1, 1, 3, 1, 1, 3, 1, 1, 3, 1, 1, 3, 1],
    [1, 1, 1, 3, 1, 3, 1, 1, 3, 1, 1, 3, 1, 1, 3, 1, 1, 3, 1, 1, 3, 1],
    [1, 1, 1, 1, 1, 3, 3, 3, 3, 3, 3, 3, 3, 3, 3, 3, 3, 3, 3, 3, 3, 3],
    [1, 1, 1, 1, 1, 3, 1, 1, 1, 1, 1, 1, 1, 1, 1, 1, 1, 1, 1, 1, 1, 1],
    [0, 0, 0, 11, 11, 3, 11, 11, 11, 11, 0, 0, 0, -1, 0, 0, 0, 0, 0, 0, 0, 0],
    [0, 0, 0, 0, -1, 3, -1, -1, 0, 0, 0, 0, 0, 0, 0, -1, 0, 0, 0, 0, -1, 0],
    [0, 0, 5, 0, 0, 8, 8, 0, 0, 0, 0, 0, 0, 0, 0, -1, 0, 0, 0, 0, 0, 0],
    [0, -1, 0, 0, -1, 8, 8, 0, 0, 0, 0, 0, 0, 0, 0, 0, 0, 0, 0, 0, 0, 0],
    [0, 0, -1, 0, 0, 8, 0, 0, -1, 0, 0, 0, 0, 0, 0, 4, 0, 0, -1, 0, 0, 0],
    [-1, 0, 0, 0, 0, 0, 0, 0, 0, -1, 0, -1, 0, 0, 4, 0, 4, -1, -1, 0, 0, 0],
    [-1, 0, 5, 0, 0, 0, 0, -1, 0, 0, 0, 0, 0, -1, 0, 0, -1, 0, 0, 0, 0, -1],
    [-1, 0, -1, 0, 0, 0, 0, 0, -1, 0, 0, 0, 0, 0, 0, 0, -1, 0, -1, -1, 5, 0],
    [-1, 0, -1, 0, 0, 0, 6, 0, 0, 0, 0, 0, 0, 0, 0, -1, 0, 0, 0, 0, 0, 0],
    [-1, 0, 0, 0, 0, 6, 6, 6, 6, 0, 0, 0, -1, 0, 0, 0, 0, 0, 0, 0, 0, -1],
    [0, 0, -1, -1, -1, -1, 0, 6, 4, -1, 5, 0, 0, -1, -1, 0, 0, -1, -1, 0, 0, 0],
    [0, 0, 0, -1, -1, 0, 0, 4, 4, 4, 4, 0, 0, 0, 0, 0, 0, 0, 0, -1, 0, 0],
    [-1, -1, 0, 0, 0, 0, 0, 0, 0, 0, 0, 0, 0, 0, 0, -1, 0, -1, 0, 0, 0, 0],
    [-1, 0, -1, 0, 0, 0, 0, 0, -1, 0, 0, 0, 5, 0, 0, 0, 0, 5, 0, -1, 0, -1]
  ],
  "height": 28,
  "id": "pier_02",
  "review": {
    "notes": "Approved by the automated picture checks (FR-084 as amended on 2026-10-06).",
    "reviewer": "automated picture checks",
    "status": "approved"
  },
  "roles": [
    {
      "colorGroup": "blue_cyan",
      "isBackground": true,
      "name": "Sky",
      "roleId": "sky"
    },
    {
      "colorGroup": "blue_cyan",
      "name": "Sea",
      "roleId": "sea"
    },
    {
      "colorGroup": "brown_orange",
      "name": "Deck",
      "roleId": "deck"
    },
    {
      "colorGroup": "brown_orange",
      "name": "Posts and rails",
      "roleId": "posts"
    },
    {
      "colorGroup": "brown_orange",
      "name": "Gulls",
      "roleId": "gulls"
    },
    {
      "colorGroup": "brown_orange",
      "name": "Stars",
      "roleId": "stars"
    },
    {
      "colorGroup": "pink_purple",
      "name": "Moon",
      "roleId": "moon"
    },
    {
      "colorGroup": "pink_purple",
      "name": "Glints on the water",
      "roleId": "glints"
    },
    {
      "colorGroup": "pink_purple",
      "name": "Lamp and hut roof",
      "roleId": "lamp"
    },
    {
      "colorGroup": "pink_purple",
      "name": "Boat",
      "roleId": "boat"
    },
    {
      "colorGroup": "green",
      "name": "Beach",
      "roleId": "beach"
    },
    {
      "colorGroup": "green",
      "name": "Island",
      "roleId": "island"
    }
  ],
  "source": {
    "kind": "generated",
    "licence": "owned",
    "origin": "content/pictures/tools/sketch_pictures.py"
  },
  "structure": {
    "backgroundShare": 0.357,
    "nestingDepth": 3,
    "regionCount": 39
  },
  "subject": "Pier 2",
  "tags": {
    "bands": ["daily"],
    "themes": ["places", "sea", "daily"]
  },
  "version": 1,
  "width": 22
}
