{
  "finishedLook": {
    "mode": "auto"
  },
  "grid": [
    [6, 4, 6, 6, 6, 6, 6, 6, 6, 6, 6, 6, 6, 6, 4],
    [6, 4, 6, 6, 6, 6, 6, 6, 6, 6, 6, 6, 6, 6, 4],
    [6, 4, 6, 2, 6, 3, 4, 3, 4, 3, 1, 0, -1, 6, 4],
    [0, 4, 0, 2, 6, 3, 3, 4, 3, 0, 1, 0, 0, 0, 4],
    [0, 4, -1, 2, 0, 0, 0, -1, 0, 0, 1, 0, 0, -1, 4],
    [4, 4, 0, 2, 0, -1, 0, 0, 0, 0, 1, 0, 0, 4, 4],
    [0, 4, 2, 2, 2, 2, 0, 0, 0, 1, 1, 1, 0, 4, 4],
    [0, 4, 2, 2, 2, 2, 2, 1, 1, 1, 0, 1, 1, 0, 4],
    [0, 0, 2, 2, 2, 2, 0, 0, 1, 1, 0, 1, 1, 0, -1],
    [0, 0, 0, 0, 0, 0, -1, -1, 0, -1, 0, 1, 0, 0, 0],
    [0, 0, 0, 0, -1, 0, 0, 0, 0, 0, -1, 7, 7, 0, -1],
    [0, 0, 0, 0, 0, -1, 0, 0, 0, 0, 0, 0, 0, -1, 0],
    [0, 0, 0, 0, 0, 5, 5, -1, 0, -1, 0, 0, 7, 0, 0],
    [-1, 0, 0, 0, 5, 5, 5, 5, 5, 0, 0, 0, 0, 0, 0],
    [0, 0, 0, 0, 5, 5, 5, 0, 5, 0, -1, 7, 7, 0, -1],
    [0, 0, 0, 0, 0, 0, -1, 0, 0, 0, 0, -1, 0, -1, -1],
    [0, 0, 0, -1, 0, 0, 0, -1, 0, 0, 0, -1, 0, -1, 0],
    [-1, 0, -1, -1, 0, -1, 0, 0, 0, 0, 0, 0, 0, 0, -1]
  ],
  "height": 18,
  "id": "coral_reef_01",
  "review": {
    "notes": "Approved by the automated picture checks (FR-084 as amended on 2026-10-06).",
    "reviewer": "automated picture checks",
    "status": "approved"
  },
  "roles": [
    {
      "colorGroup": "blue_cyan",
      "isBackground": true,
      "name": "Water",
      "roleId": "water"
    },
    {
      "colorGroup": "pink_purple",
      "name": "Branching coral",
      "roleId": "coral"
    },
    {
      "colorGroup": "pink_purple",
      "name": "Fan coral",
      "roleId": "fan"
    },
    {
      "colorGroup": "green",
      "name": "Brain coral",
      "roleId": "brain"
    },
    {
      "colorGroup": "green",
      "name": "Seaweed and coral folds",
      "roleId": "weed"
    },
    {
      "colorGroup": "brown_orange",
      "name": "Fish",
      "roleId": "fish"
    },
    {
      "colorGroup": "brown_orange",
      "name": "Sand",
      "roleId": "sand"
    },
    {
      "colorGroup": "blue_cyan",
      "name": "Bubbles and eyes",
      "roleId": "bubbles"
    }
  ],
  "source": {
    "kind": "generated",
    "licence": "owned",
    "origin": "content/pictures/tools/sketch_pictures.py"
  },
  "structure": {
    "backgroundShare": 0.477,
    "nestingDepth": 4,
    "regionCount": 27
  },
  "subject": "Coral reef 1",
  "tags": {
    "bands": ["regular"],
    "themes": ["sea"]
  },
  "version": 1,
  "width": 15
}
